{
  "refId": "pipe-schedules",
  "version": "1.0.0",
  "source": "ASME B36.10M-2022 (carbon and alloy steel); ASME B36.19M-2018 (stainless, the S schedules)",
  "note": "Wall thickness in millimetres. The table is SPARSE ON PURPOSE: an absent (size, schedule) pair does not exist in the standard and must raise, never default to zero. STD is NOT an alias of SCH 40 above NPS 10, and XS is NOT an alias of SCH 80 above NPS 8 - see ADR-007 section 2.",
  "units": {
    "wall": "millimetre"
  },
  "schedules": [
    "5",
    "5S",
    "10",
    "10S",
    "20",
    "30",
    "40",
    "40S",
    "STD",
    "60",
    "80",
    "80S",
    "XS",
    "100",
    "120",
    "140",
    "160",
    "XXS"
  ],
  "aliasWarning": {
    "stdEqualsSch40UpTo": "10",
    "xsEqualsSch80UpTo": "8",
    "stdFixedAbove": 9.53,
    "xsFixedAbove": 12.7
  },
  "walls": {
    "1/8": {
      "5S": 1.24,
      "10": 1.24,
      "10S": 1.73,
      "30": 1.45,
      "40": 1.73,
      "40S": 1.73,
      "STD": 1.73,
      "80": 2.41,
      "80S": 2.41,
      "XS": 2.41
    },
    "1/4": {
      "5S": 1.65,
      "10": 1.65,
      "10S": 2.24,
      "30": 1.85,
      "40": 2.24,
      "40S": 2.24,
      "STD": 2.24,
      "80": 3.02,
      "80S": 3.02,
      "XS": 3.02
    },
    "3/8": {
      "5S": 1.65,
      "10": 1.65,
      "10S": 2.31,
      "30": 1.85,
      "40": 2.31,
      "40S": 2.31,
      "STD": 2.31,
      "80": 3.2,
      "80S": 3.2,
      "XS": 3.2
    },
    "1/2": {
      "5S": 1.65,
      "10": 2.11,
      "10S": 2.11,
      "30": 2.41,
      "40": 2.77,
      "40S": 2.77,
      "STD": 2.77,
      "80": 3.73,
      "80S": 3.73,
      "XS": 3.73,
      "160": 4.78,
      "XXS": 7.47
    },
    "3/4": {
      "5S": 1.65,
      "10": 2.11,
      "10S": 2.11,
      "30": 2.41,
      "40": 2.87,
      "40S": 2.87,
      "STD": 2.87,
      "80": 3.91,
      "80S": 3.91,
      "XS": 3.91,
      "160": 5.56,
      "XXS": 7.82
    },
    "1": {
      "5S": 1.65,
      "10": 2.77,
      "10S": 2.77,
      "30": 2.9,
      "40": 3.38,
      "40S": 3.38,
      "STD": 3.38,
      "80": 4.55,
      "80S": 4.55,
      "XS": 4.55,
      "160": 6.35,
      "XXS": 9.09
    },
    "1 1/4": {
      "5S": 1.65,
      "10": 2.77,
      "10S": 2.77,
      "30": 2.97,
      "40": 3.56,
      "40S": 3.56,
      "STD": 3.56,
      "80": 4.85,
      "80S": 4.85,
      "XS": 4.85,
      "160": 6.35,
      "XXS": 9.7
    },
    "1 1/2": {
      "5S": 1.65,
      "10": 2.77,
      "10S": 2.77,
      "30": 3.18,
      "40": 3.68,
      "40S": 3.68,
      "STD": 3.68,
      "80": 5.08,
      "80S": 5.08,
      "XS": 5.08,
      "160": 7.14,
      "XXS": 10.15
    },
    "2": {
      "5S": 1.65,
      "10": 2.77,
      "10S": 2.77,
      "30": 3.18,
      "40": 3.91,
      "40S": 3.91,
      "STD": 3.91,
      "80": 5.54,
      "80S": 5.54,
      "XS": 5.54,
      "160": 8.74,
      "XXS": 11.07
    },
    "2 1/2": {
      "5S": 2.11,
      "10": 3.05,
      "10S": 3.05,
      "30": 4.78,
      "40": 5.16,
      "40S": 5.16,
      "STD": 5.16,
      "80": 7.01,
      "80S": 7.01,
      "XS": 7.01,
      "160": 9.53,
      "XXS": 14.02
    },
    "3": {
      "5S": 2.11,
      "10": 3.05,
      "10S": 3.05,
      "30": 4.78,
      "40": 5.49,
      "40S": 5.49,
      "STD": 5.49,
      "80": 7.62,
      "80S": 7.62,
      "XS": 7.62,
      "160": 11.13,
      "XXS": 15.24
    },
    "3 1/2": {
      "5S": 2.11,
      "10": 3.05,
      "10S": 3.05,
      "30": 4.78,
      "40": 5.74,
      "40S": 5.74,
      "STD": 5.74,
      "80": 8.08,
      "80S": 8.08,
      "XS": 8.08,
      "XXS": 16.15
    },
    "4": {
      "5S": 2.11,
      "10": 3.05,
      "10S": 3.05,
      "30": 4.78,
      "40": 6.02,
      "40S": 6.02,
      "STD": 6.02,
      "80": 8.56,
      "80S": 8.56,
      "XS": 8.56,
      "120": 11.13,
      "160": 13.49,
      "XXS": 17.12
    },
    "5": {
      "5S": 2.77,
      "10": 3.4,
      "10S": 3.4,
      "40": 6.55,
      "40S": 6.55,
      "STD": 6.55,
      "80": 9.53,
      "80S": 9.53,
      "XS": 9.53,
      "120": 12.7,
      "160": 15.88,
      "XXS": 19.05
    },
    "6": {
      "5S": 2.77,
      "10": 3.4,
      "10S": 3.4,
      "30": 4.78,
      "40": 7.11,
      "40S": 7.11,
      "STD": 7.11,
      "80": 10.97,
      "80S": 10.97,
      "XS": 10.97,
      "120": 14.27,
      "160": 18.26,
      "XXS": 21.95
    },
    "8": {
      "5S": 2.77,
      "10": 3.76,
      "10S": 3.76,
      "20": 6.35,
      "30": 7.04,
      "40": 8.18,
      "40S": 8.18,
      "STD": 8.18,
      "60": 10.31,
      "80": 12.7,
      "80S": 12.7,
      "XS": 12.7,
      "100": 15.09,
      "120": 18.26,
      "140": 20.62,
      "160": 23.01,
      "XXS": 22.23
    },
    "10": {
      "5S": 3.4,
      "10": 4.19,
      "10S": 4.19,
      "20": 6.35,
      "30": 7.8,
      "40": 9.27,
      "40S": 9.27,
      "STD": 9.27,
      "60": 12.7,
      "80": 15.09,
      "80S": 12.7,
      "XS": 12.7,
      "100": 18.26,
      "120": 21.44,
      "140": 25.4,
      "160": 28.58,
      "XXS": 25.4
    },
    "12": {
      "5S": 3.96,
      "10": 4.57,
      "10S": 4.57,
      "20": 6.35,
      "30": 8.38,
      "40": 10.31,
      "40S": 9.53,
      "STD": 9.53,
      "60": 14.27,
      "80": 17.48,
      "80S": 12.7,
      "XS": 12.7,
      "100": 21.44,
      "120": 25.4,
      "140": 28.58,
      "160": 33.32,
      "XXS": 25.4
    },
    "14": {
      "5S": 3.96,
      "10": 6.35,
      "10S": 4.78,
      "20": 7.92,
      "30": 9.53,
      "40": 11.13,
      "STD": 9.53,
      "60": 15.09,
      "80": 19.05,
      "XS": 12.7,
      "100": 23.83,
      "120": 27.79,
      "140": 31.75,
      "160": 35.71
    },
    "16": {
      "5S": 4.19,
      "10": 6.35,
      "10S": 4.78,
      "20": 7.92,
      "30": 9.53,
      "40": 12.7,
      "STD": 9.53,
      "60": 16.66,
      "80": 21.44,
      "XS": 12.7,
      "100": 26.19,
      "120": 30.96,
      "140": 36.53,
      "160": 40.49
    },
    "18": {
      "5S": 4.19,
      "10": 6.35,
      "10S": 4.78,
      "20": 7.92,
      "30": 11.13,
      "40": 14.27,
      "STD": 9.53,
      "60": 19.05,
      "80": 23.83,
      "XS": 12.7,
      "100": 29.36,
      "120": 34.93,
      "140": 39.67,
      "160": 45.24
    },
    "20": {
      "5S": 4.78,
      "10": 6.35,
      "10S": 5.54,
      "20": 12.7,
      "30": 15.09,
      "40": 20.62,
      "STD": 9.53,
      "60": 26.19,
      "80": 32.54,
      "XS": 12.7,
      "100": 38.1,
      "120": 44.45,
      "140": 50.01,
      "160": 59.54
    },
    "22": {
      "5S": 4.78,
      "10": 6.35,
      "10S": 5.54,
      "20": 12.7,
      "30": 15.09,
      "STD": 9.53,
      "60": 28.58,
      "80": 34.93,
      "XS": 12.7,
      "100": 41.28,
      "120": 47.63,
      "140": 53.98,
      "160": 59.54
    },
    "24": {
      "5S": 5.54,
      "10": 6.35,
      "10S": 6.35,
      "20": 12.7,
      "30": 14.27,
      "40": 17.48,
      "STD": 9.53,
      "60": 24.61,
      "80": 30.96,
      "XS": 12.7,
      "100": 38.89,
      "120": 46.02,
      "140": 52.37,
      "160": 59.54
    },
    "26": {
      "10": 7.92,
      "20": 12.7,
      "STD": 9.53,
      "XS": 12.7
    },
    "28": {
      "10": 7.92,
      "20": 12.7,
      "30": 15.88,
      "STD": 9.53,
      "XS": 12.7
    },
    "30": {
      "5S": 4.78,
      "10": 7.92,
      "10S": 7.92,
      "20": 12.7,
      "30": 15.88,
      "STD": 9.53,
      "XS": 12.7
    },
    "32": {
      "10": 7.92,
      "20": 12.7,
      "30": 15.88,
      "40": 17.48,
      "STD": 9.53,
      "XS": 12.7
    },
    "34": {
      "10": 7.92,
      "20": 12.7,
      "30": 15.88,
      "40": 17.48,
      "STD": 9.53,
      "XS": 12.7
    },
    "36": {
      "10": 7.92,
      "20": 12.7,
      "30": 15.88,
      "40": 19.05,
      "STD": 9.53,
      "XS": 12.7
    },
    "38": {
      "STD": 9.53,
      "XS": 12.7
    },
    "40": {
      "STD": 9.53,
      "XS": 12.7
    },
    "42": {
      "STD": 9.53,
      "XS": 12.7
    },
    "44": {
      "STD": 9.53,
      "XS": 12.7
    },
    "46": {
      "STD": 9.53,
      "XS": 12.7
    },
    "48": {
      "STD": 9.53,
      "XS": 12.7
    }
  }
}
